{
  "schema_version": 1,
  "sample": "demo_filex.trx",
  "input_sha256": "97666f2cf5f7e28030922bc879209f2147b0852d69fb6f6f78472b7214cce742",
  "source_url": "https://github.com/eclipse-threadx/tracex/blob/b1af4decb38d48958ce3fa5c70d403f0d48aa25b/src/MsixPackageProject/TraceFiles/demo_filex.trx",
  "byte_order": "LITTLE_ENDIAN",
  "timer_mask": 4294967295,
  "timer_direction": "increasing",
  "event_count": 950,
  "registry": [
    {
      "type": 1,
      "address": 77424,
      "parameter1": 77752,
      "parameter2": 1024,
      "name": "System Timer Thread"
    },
    {
      "type": 1,
      "address": 69580,
      "parameter1": 184004,
      "parameter2": 2048,
      "name": "thread 0"
    },
    {
      "type": 2,
      "address": 79040,
      "parameter1": 1000,
      "parameter2": 1000,
      "name": "FileX System Timer"
    },
    {
      "type": 9,
      "address": 69756,
      "parameter1": 16,
      "parameter2": 4,
      "name": "RAM DISK"
    },
    {
      "type": 5,
      "address": 70196,
      "parameter1": 0,
      "parameter2": 0,
      "name": "FileX Media Mutex"
    },
    {
      "type": 10,
      "address": 76936,
      "parameter1": 0,
      "parameter2": 0,
      "name": "TEST.TXT"
    }
  ],
  "first_event": {
    "context": 69580,
    "raw_priority": 1,
    "raw_event_id": 206,
    "event_id": 206,
    "raw_timestamp": 259000,
    "masked_timestamp": 259000,
    "relative_ticks": 0,
    "info": [
      69756,
      12,
      1,
      111584
    ]
  },
  "last_event": {
    "context": 69580,
    "raw_priority": 1,
    "raw_event_id": 206,
    "event_id": 206,
    "raw_timestamp": 1208000,
    "masked_timestamp": 1208000,
    "relative_ticks": 949000,
    "info": [
      69756,
      3,
      1,
      111456
    ]
  },
  "histogram": {
    "50": 18,
    "51": 19,
    "52": 166,
    "57": 148,
    "103": 19,
    "107": 38,
    "201": 93,
    "202": 18,
    "203": 19,
    "204": 18,
    "205": 19,
    "206": 94,
    "207": 38,
    "208": 19,
    "210": 19,
    "211": 19,
    "214": 19,
    "243": 19,
    "244": 18,
    "247": 18,
    "248": 19,
    "251": 37,
    "254": 18,
    "258": 19,
    "261": 19
  },
  "raw_timestamps": [259000, 260000, 261000, 262000, 263000, 264000, 265000, 266000, 267000, 268000, 269000, 270000, 271000, 272000, 273000, 274000, 275000, 276000, 277000, 278000, 279000, 280000, 281000, 282000, 283000, 284000, 285000, 286000, 287000, 288000, 289000, 290000, 291000, 292000, 293000, 294000, 295000, 296000, 297000, 298000, 299000, 300000, 301000, 302000, 303000, 304000, 305000, 306000, 307000, 308000, 309000, 310000, 311000, 312000, 313000, 314000, 315000, 316000, 317000, 318000, 319000, 320000, 321000, 322000, 323000, 324000, 325000, 326000, 327000, 328000, 329000, 330000, 331000, 332000, 333000, 334000, 335000, 336000, 337000, 338000, 339000, 340000, 341000, 342000, 343000, 344000, 345000, 346000, 347000, 348000, 349000, 350000, 351000, 352000, 353000, 354000, 355000, 356000, 357000, 358000, 359000, 360000, 361000, 362000, 363000, 364000, 365000, 366000, 367000, 368000, 369000, 370000, 371000, 372000, 373000, 374000, 375000, 376000, 377000, 378000, 379000, 380000, 381000, 382000, 383000, 384000, 385000, 386000, 387000, 388000, 389000, 390000, 391000, 392000, 393000, 394000, 395000, 396000, 397000, 398000, 399000, 400000, 401000, 402000, 403000, 404000, 405000, 406000, 407000, 408000, 409000, 410000, 411000, 412000, 413000, 414000, 415000, 416000, 417000, 418000, 419000, 420000, 421000, 422000, 423000, 424000, 425000, 426000, 427000, 428000, 429000, 430000, 431000, 432000, 433000, 434000, 435000, 436000, 437000, 438000, 439000, 440000, 441000, 442000, 443000, 444000, 445000, 446000, 447000, 448000, 449000, 450000, 451000, 452000, 453000, 454000, 455000, 456000, 457000, 458000, 459000, 460000, 461000, 462000, 463000, 464000, 465000, 466000, 467000, 468000, 469000, 470000, 471000, 472000, 473000, 474000, 475000, 476000, 477000, 478000, 479000, 480000, 481000, 482000, 483000, 484000, 485000, 486000, 487000, 488000, 489000, 490000, 491000, 492000, 493000, 494000, 495000, 496000, 497000, 498000, 499000, 500000, 501000, 502000, 503000, 504000, 505000, 506000, 507000, 508000, 509000, 510000, 511000, 512000, 513000, 514000, 515000, 516000, 517000, 518000, 519000, 520000, 521000, 522000, 523000, 524000, 525000, 526000, 527000, 528000, 529000, 530000, 531000, 532000, 533000, 534000, 535000, 536000, 537000, 538000, 539000, 540000, 541000, 542000, 543000, 544000, 545000, 546000, 547000, 548000, 549000, 550000, 551000, 552000, 553000, 554000, 555000, 556000, 557000, 558000, 559000, 560000, 561000, 562000, 563000, 564000, 565000, 566000, 567000, 568000, 569000, 570000, 571000, 572000, 573000, 574000, 575000, 576000, 577000, 578000, 579000, 580000, 581000, 582000, 583000, 584000, 585000, 586000, 587000, 588000, 589000, 590000, 591000, 592000, 593000, 594000, 595000, 596000, 597000, 598000, 599000, 600000, 601000, 602000, 603000, 604000, 605000, 606000, 607000, 608000, 609000, 610000, 611000, 612000, 613000, 614000, 615000, 616000, 617000, 618000, 619000, 620000, 621000, 622000, 623000, 624000, 625000, 626000, 627000, 628000, 629000, 630000, 631000, 632000, 633000, 634000, 635000, 636000, 637000, 638000, 639000, 640000, 641000, 642000, 643000, 644000, 645000, 646000, 647000, 648000, 649000, 650000, 651000, 652000, 653000, 654000, 655000, 656000, 657000, 658000, 659000, 660000, 661000, 662000, 663000, 664000, 665000, 666000, 667000, 668000, 669000, 670000, 671000, 672000, 673000, 674000, 675000, 676000, 677000, 678000, 679000, 680000, 681000, 682000, 683000, 684000, 685000, 686000, 687000, 688000, 689000, 690000, 691000, 692000, 693000, 694000, 695000, 696000, 697000, 698000, 699000, 700000, 701000, 702000, 703000, 704000, 705000, 706000, 707000, 708000, 709000, 710000, 711000, 712000, 713000, 714000, 715000, 716000, 717000, 718000, 719000, 720000, 721000, 722000, 723000, 724000, 725000, 726000, 727000, 728000, 729000, 730000, 731000, 732000, 733000, 734000, 735000, 736000, 737000, 738000, 739000, 740000, 741000, 742000, 743000, 744000, 745000, 746000, 747000, 748000, 749000, 750000, 751000, 752000, 753000, 754000, 755000, 756000, 757000, 758000, 759000, 760000, 761000, 762000, 763000, 764000, 765000, 766000, 767000, 768000, 769000, 770000, 771000, 772000, 773000, 774000, 775000, 776000, 777000, 778000, 779000, 780000, 781000, 782000, 783000, 784000, 785000, 786000, 787000, 788000, 789000, 790000, 791000, 792000, 793000, 794000, 795000, 796000, 797000, 798000, 799000, 800000, 801000, 802000, 803000, 804000, 805000, 806000, 807000, 808000, 809000, 810000, 811000, 812000, 813000, 814000, 815000, 816000, 817000, 818000, 819000, 820000, 821000, 822000, 823000, 824000, 825000, 826000, 827000, 828000, 829000, 830000, 831000, 832000, 833000, 834000, 835000, 836000, 837000, 838000, 839000, 840000, 841000, 842000, 843000, 844000, 845000, 846000, 847000, 848000, 849000, 850000, 851000, 852000, 853000, 854000, 855000, 856000, 857000, 858000, 859000, 860000, 861000, 862000, 863000, 864000, 865000, 866000, 867000, 868000, 869000, 870000, 871000, 872000, 873000, 874000, 875000, 876000, 877000, 878000, 879000, 880000, 881000, 882000, 883000, 884000, 885000, 886000, 887000, 888000, 889000, 890000, 891000, 892000, 893000, 894000, 895000, 896000, 897000, 898000, 899000, 900000, 901000, 902000, 903000, 904000, 905000, 906000, 907000, 908000, 909000, 910000, 911000, 912000, 913000, 914000, 915000, 916000, 917000, 918000, 919000, 920000, 921000, 922000, 923000, 924000, 925000, 926000, 927000, 928000, 929000, 930000, 931000, 932000, 933000, 934000, 935000, 936000, 937000, 938000, 939000, 940000, 941000, 942000, 943000, 944000, 945000, 946000, 947000, 948000, 949000, 950000, 951000, 952000, 953000, 954000, 955000, 956000, 957000, 958000, 959000, 960000, 961000, 962000, 963000, 964000, 965000, 966000, 967000, 968000, 969000, 970000, 971000, 972000, 973000, 974000, 975000, 976000, 977000, 978000, 979000, 980000, 981000, 982000, 983000, 984000, 985000, 986000, 987000, 988000, 989000, 990000, 991000, 992000, 993000, 994000, 995000, 996000, 997000, 998000, 999000, 1000000, 1001000, 1002000, 1003000, 1004000, 1005000, 1006000, 1007000, 1008000, 1009000, 1010000, 1011000, 1012000, 1013000, 1014000, 1015000, 1016000, 1017000, 1018000, 1019000, 1020000, 1021000, 1022000, 1023000, 1024000, 1025000, 1026000, 1027000, 1028000, 1029000, 1030000, 1031000, 1032000, 1033000, 1034000, 1035000, 1036000, 1037000, 1038000, 1039000, 1040000, 1041000, 1042000, 1043000, 1044000, 1045000, 1046000, 1047000, 1048000, 1049000, 1050000, 1051000, 1052000, 1053000, 1054000, 1055000, 1056000, 1057000, 1058000, 1059000, 1060000, 1061000, 1062000, 1063000, 1064000, 1065000, 1066000, 1067000, 1068000, 1069000, 1070000, 1071000, 1072000, 1073000, 1074000, 1075000, 1076000, 1077000, 1078000, 1079000, 1080000, 1081000, 1082000, 1083000, 1084000, 1085000, 1086000, 1087000, 1088000, 1089000, 1090000, 1091000, 1092000, 1093000, 1094000, 1095000, 1096000, 1097000, 1098000, 1099000, 1100000, 1101000, 1102000, 1103000, 1104000, 1105000, 1106000, 1107000, 1108000, 1109000, 1110000, 1111000, 1112000, 1113000, 1114000, 1115000, 1116000, 1117000, 1118000, 1119000, 1120000, 1121000, 1122000, 1123000, 1124000, 1125000, 1126000, 1127000, 1128000, 1129000, 1130000, 1131000, 1132000, 1133000, 1134000, 1135000, 1136000, 1137000, 1138000, 1139000, 1140000, 1141000, 1142000, 1143000, 1144000, 1145000, 1146000, 1147000, 1148000, 1149000, 1150000, 1151000, 1152000, 1153000, 1154000, 1155000, 1156000, 1157000, 1158000, 1159000, 1160000, 1161000, 1162000, 1163000, 1164000, 1165000, 1166000, 1167000, 1168000, 1169000, 1170000, 1171000, 1172000, 1173000, 1174000, 1175000, 1176000, 1177000, 1178000, 1179000, 1180000, 1181000, 1182000, 1183000, 1184000, 1185000, 1186000, 1187000, 1188000, 1189000, 1190000, 1191000, 1192000, 1193000, 1194000, 1195000, 1196000, 1197000, 1198000, 1199000, 1200000, 1201000, 1202000, 1203000, 1204000, 1205000, 1206000, 1207000, 1208000],